### ISSUE TITLE
Assymetric Routing (Rule De-synchronization)

### ISSUE THREAD

**Issue by manhole6328** [h44z/wg-portal#713]
**Describe the bug**
Under certain configuration reloads or interface restarts, wg-portal stops synchronizing the policy-based IP routing rules (ip rule) to the Linux kernel, while leaving the custom routing tables intact (e.g., table 20006). Because the IP rules pointing to these custom tables vanish, the host falls back to its main routing table and default gateway. This creates an asymmetric routing loop inside the kernel, where forwarded ICMP replies are repeatedly sent out and received back on the physical interface (ens18), resulting in extreme log flood and packet loops.

**Expected behavior**
When modifying configurations or restarting interfaces, wg-portal should reliably synchronize both the ip route tables and their accompanying ip rule mapping structures, ensuring they are never left in a mismatched state.

**Steps to reproduce**

Run wg-portal with multiple peers across separate interfaces (wg0, wg1, wg2).

Perform configuration updates or toggle/restart an interface inside the Web UI.

Observe that ip r show table all still lists the tables (e.g., 10.125.13.18 dev wg1 table 20006 scope link), but running ip rule show reveals that the corresponding rule directing traffic to that table has been dropped.

Try to ping the WireGuard peer from a local subnet machine; the packet loops infinitely between the host and the default physical gateway.

**Additional context**

Running systemctl restart wg-portal or fully rebooting the server completely recreates the rules and resolves the loop, confirming a runtime de-synchronization between wg-portal and the kernel network rules.

The routing table is the same as before the reboot. The rules table... Sorry, I forgot to track it.

```yaml
# docker-compose.yaml

services:
  wg-portal:
    image: wgportal/wg-portal:v2.2.3
    container_name: wg-portal
    restart: unless-stopped
    cap_add:
      - NET_ADMIN
    network_mode: host
    volumes:
      - ./config:/app/config:ro
      - wg-portal-data:/app/data
```
``` tcpdump output
tcpdump: data link type LINUX_SLL2
tcpdump: verbose output suppressed, use -v[v]... for full protocol decode
listening on any, link-type LINUX_SLL2 (Linux cooked v2), snapshot length 262144 bytes
15:47:04.191359 wg1   In  IP 10.125.13.18 > 172.16.9.29: ICMP echo request, id 29121, seq 0, length 64
15:47:04.191393 ens18 Out IP 10.125.13.18 > 172.16.9.29: ICMP echo request, id 29121, seq 0, length 64
15:47:04.191868 ens18 In  IP 172.16.9.29 > 10.125.13.18: ICMP echo reply, id 29121, seq 0, length 64
15:47:04.191956 ens18 Out IP wg-ttit > 172.16.9.29: ICMP redirect 10.125.13.18 to host _gateway, length 92
15:47:04.191971 ens18 Out IP 172.16.9.29 > 10.125.13.18: ICMP echo reply, id 29121, seq 0, length 64
15:47:04.192054 ens18 In  IP 172.16.9.29 > 10.125.13.18: ICMP echo reply, id 29121, seq 0, length 64
15:47:04.192063 ens18 Out IP 172.16.9.29 > 10.125.13.18: ICMP echo reply, id 29121, seq 0, length 64
15:47:04.192145 ens18 In  IP 172.16.9.29 > 10.125.13.18: ICMP echo reply, id 29121, seq 0, length 64
15:47:04.192152 ens18 Out IP 172.16.9.29 > 10.125.13.18: ICMP echo reply, id 29121, seq 0, length 64
15:47:04.192207 ens18 In  IP 172.16.9.29 > 10.125.13.18: ICMP echo reply, id 29121, seq 0, length 64
15:47:04.192213 ens18 Out IP 172.16.9.29 > 10.125.13.18: ICMP echo reply, id 29121, seq 0, length 64
```
Subnet inside a tunnel: 10.125.13.16/28 
Application version: v2.2.3
Install method: docker compose (network mode: host)
OS: Ubuntu Server

**Comment by manhole6328** [comment]
My wg route list:
``` 
$ ip route show table all
10.125.13.10 dev wg0 table 20005 scope link 
10.125.13.18 dev wg1 table 20006 scope link 
10.125.13.19 dev wg1 table 20006 scope link 
10.125.13.20 dev wg1 table 20006 scope link 
10.125.13.21 dev wg1 table 20006 scope link 
10.125.13.34 dev wg2 table 20007 scope link
..... And so on...
```

The expected ip rules:
```
$ ip rule show
0:	from all lookup local
32698:	not from all fwmark 0x4e27 lookup 20007
32699:	not from all fwmark 0x4e26 lookup 20006
32700:	not from all fwmark 0x4e25 lookup 20005
32766:	from all lookup main
32767:	from all lookup default
```

The having ip rules
```
$ ip rule show
0:	from all lookup local
32766:	from all lookup main
32767:	from all lookup default
```


Only container restarting helps and restores ip rules.

**Comment by blogbytes** [comment]
Experiencing the exact same issue.

**Comment by manhole6328** [comment]
Probably, this is not a wg-portal issue. I have experienced another Ubuntu Server host flushing IP rules due to network reconfiguration or network daemon actions. You can try preventing daemons from touching the IP rules.
